{"$schema":"http://json-schema.org/draft-07/schema#","title":"OSS Tools","type":"array","minItems":1,"items":{"type":"object","required":["id","name","category","description","url","relevantFor"],"properties":{"id":{"type":"string","pattern":"^[a-z][a-z0-9-]*$"},"name":{"type":"string","minLength":2},"category":{"type":"string","minLength":2},"description":{"type":"string","minLength":10},"url":{"type":"string","format":"uri"},"relevantFor":{"type":"array","minItems":1,"items":{"type":"string"}}},"additionalProperties":false}}